{"version": 1, "producer": {"name": "pyte", "version": "0.8.2"}, "size": {"cols": 80, "rows": 24}, "cursor": {"row": 0, "col": 40, "visible": true, "style": null, "blink": null}, "altScreen": false, "title": "", "rows": [[{"text": "A"}, {"text": "B"}, {"text": "C"}, {"text": "D"}, {"text": "E"}, {"text": "F"}, {"text": "G"}, {"text": "H"}, {"text": "I"}, {"text": "J"}, {"text": "K"}, {"text": "L"}, {"text": "M"}, {"text": "N"}, {"text": "O"}, {"text": "P"}, {"text": "Q"}, {"text": "R"}, {"text": "S"}, {"text": "T"}, {"text": "U"}, {"text": "V"}, {"text": "W"}, {"text": "X"}, {"text": "Y"}, {"text": "Z"}, {"text": "A"}, {"text": "B"}, {"text": "C"}, {"text": "D"}, {"text": "E"}, {"text": "F"}, {"text": "G"}, {"text": "H"}, {"text": "I"}, {"text": "J"}, {"text": "K"}, {"text": "L"}, {"text": "M"}, {"text": "M"}, {"text": "O"}, {"text": "P"}, {"text": "Q"}, {"text": "R"}, {"text": "S"}, {"text": "T"}, {"text": "U"}, {"text": "V"}, {"text": "W"}, {"text": "X"}, {"text": "Y"}, {"text": "Z"}, {"text": "A"}, {"text": "B"}, {"text": "C"}, {"text": "D"}, {"text": "E"}, {"text": "F"}, {"text": "G"}, {"text": "H"}, {"text": "I"}, {"text": "J"}, {"text": "K"}, {"text": "L"}, {"text": "M"}, {"text": "N"}, {"text": "O"}, {"text": "P"}, {"text": "Q"}, {"text": "R"}, {"text": "S"}, {"text": "T"}, {"text": "U"}, {"text": "V"}, {"text": "W"}, {"text": "X"}, {"text": "Y"}, {"text": "Z"}, {"text": "A"}, {"text": "B"}], [], [], [], [], [], [], [], [], [], [], [], [], [], [], [], [], [], [], [], [], [], [], []], "case": "pending-wrap-cup"}
