{"version": 1, "producer": {"name": "pyte", "version": "0.8.2"}, "size": {"cols": 80, "rows": 24}, "cursor": {"row": 2, "col": 0, "visible": true, "style": null, "blink": null}, "altScreen": false, "title": "", "rows": [[{}, {}, {}, {}, {}, {}, {}, {}, {}, {}, {}, {}, {}, {}, {}, {}, {}, {}, {}, {}, {}, {}, {}, {}, {}, {}, {}, {}, {}, {}, {}, {}, {}, {}, {}, {}, {}, {}, {}, {}, {}, {}, {}, {}, {}, {}, {}, {}, {}, {}, {}, {}, {}, {}, {}, {}, {}, {}, {}, {}, {}, {}, {}, {}, {}, {}, {}, {}, {}, {}, {}, {}, {}, {}, {}, {}, {"text": "a"}, {"text": "b"}, {"text": "漢", "width": 2}, {"text": "", "width": 0}], [], [], [], [], [], [], [], [], [], [], [], [], [], [], [], [], [], [], [], [], [], [], []], "case": "ich-wide-edge"}
