{"version": 1, "producer": {"name": "pyte", "version": "0.8.2"}, "size": {"cols": 80, "rows": 24}, "cursor": {"row": 4, "col": 13, "visible": true, "style": null, "blink": null}, "altScreen": false, "title": "", "rows": [[], [], [], [], [{"text": "p"}, {"text": "u"}, {"text": "s"}, {"text": "h"}, {"text": "e"}, {"text": "d"}, {"text": "-"}, {"text": "d"}, {"text": "o"}, {"text": "w"}, {"text": "n"}, {"text": "-"}, {"text": "2"}], [{"text": "p"}, {"text": "u"}, {"text": "s"}, {"text": "h"}, {"text": "e"}, {"text": "d"}, {"text": "-"}, {"text": "d"}, {"text": "o"}, {"text": "w"}, {"text": "n"}, {"text": "-"}, {"text": "1"}], [{"text": "t"}, {"text": "o"}, {"text": "p"}, {"text": "-"}, {"text": "o"}, {"text": "f"}, {"text": "-"}, {"text": "r"}, {"text": "e"}, {"text": "g"}, {"text": "i"}, {"text": "o"}, {"text": "n"}], [], [{"text": "t"}, {"text": "h"}, {"text": "i"}, {"text": "r"}, {"text": "d"}, {"text": "-"}, {"text": "r"}, {"text": "o"}, {"text": "w"}], [], [], [], [], [], [], [], [], [], [], [], [], [], [], []], "case": "scroll-region-ri"}
