{"version": 1, "producer": {"name": "pyte", "version": "0.8.2"}, "size": {"cols": 80, "rows": 24}, "cursor": {"row": 3, "col": 16, "visible": true}, "altScreen": false, "title": "", "rows": [[{"text": "f", "fg": 0}, {"text": "0", "fg": 0}, {"text": "f", "fg": 1}, {"text": "1", "fg": 1}, {"text": "f", "fg": 2}, {"text": "2", "fg": 2}, {"text": "f", "fg": 3}, {"text": "3", "fg": 3}, {"text": "f", "fg": 4}, {"text": "4", "fg": 4}, {"text": "f", "fg": 5}, {"text": "5", "fg": 5}, {"text": "f", "fg": 6}, {"text": "6", "fg": 6}, {"text": "f", "fg": 7}, {"text": "7", "fg": 7}], [{"text": "F", "fg": 8}, {"text": "0", "fg": 8}, {"text": "F", "fg": 9}, {"text": "1", "fg": 9}, {"text": "F", "fg": 10}, {"text": "2", "fg": 10}, {"text": "F", "fg": 11}, {"text": "3", "fg": 11}, {"text": "F", "fg": 12}, {"text": "4", "fg": 12}, {"text": "F", "fg": 13}, {"text": "5", "fg": 13}, {"text": "F", "fg": 14}, {"text": "6", "fg": 14}, {"text": "F", "fg": 15}, {"text": "7", "fg": 15}], [{"text": "b", "bg": 0}, {"text": "0", "bg": 0}, {"text": "b", "bg": 1}, {"text": "1", "bg": 1}, {"text": "b", "bg": 2}, {"text": "2", "bg": 2}, {"text": "b", "bg": 3}, {"text": "3", "bg": 3}, {"text": "b", "bg": 4}, {"text": "4", "bg": 4}, {"text": "b", "bg": 5}, {"text": "5", "bg": 5}, {"text": "b", "bg": 6}, {"text": "6", "bg": 6}, {"text": "b", "bg": 7}, {"text": "7", "bg": 7}], [{"text": "B", "bg": 8}, {"text": "0", "bg": 8}, {"text": "B", "bg": 9}, {"text": "1", "bg": 9}, {"text": "B", "bg": 10}, {"text": "2", "bg": 10}, {"text": "B", "bg": 11}, {"text": "3", "bg": 11}, {"text": "B", "bg": 12}, {"text": "4", "bg": 12}, {"text": "B", "bg": 13}, {"text": "5", "bg": 13}, {"text": "B", "bg": 14}, {"text": "6", "bg": 14}, {"text": "B", "bg": 15}, {"text": "7", "bg": 15}], [], [], [], [], [], [], [], [], [], [], [], [], [], [], [], [], [], [], [], []], "case": "sgr-16color"}
