{"version": 1, "producer": {"name": "pyte", "version": "0.8.2"}, "size": {"cols": 80, "rows": 24}, "cursor": {"row": 0, "col": 0, "visible": true, "style": null, "blink": null}, "altScreen": false, "title": "", "rows": [[], [], [], [], [{"text": "a"}, {"text": "t"}, {"text": "-"}, {"text": "r"}, {"text": "e"}, {"text": "g"}, {"text": "i"}, {"text": "o"}, {"text": "n"}, {"text": "-"}, {"text": "t"}, {"text": "o"}, {"text": "p"}], [], [{}, {}, {}, {}, {}, {}, {}, {}, {}, {"text": "r"}, {"text": "e"}, {"text": "g"}, {"text": "i"}, {"text": "o"}, {"text": "n"}, {"text": "-"}, {"text": "r"}, {"text": "3"}, {"text": "c"}, {"text": "1"}, {"text": "0"}], [], [], [], [], [], [], [], [], [], [], [], [], [], [], [], [], []], "case": "origin-mode-decom"}
