{"version": 1, "producer": {"name": "pyte", "version": "0.8.2"}, "size": {"cols": 80, "rows": 24}, "cursor": {"row": 3, "col": 2, "visible": true, "style": null, "blink": null}, "altScreen": false, "title": "", "rows": [[{"text": "s", "fg": 2, "bold": true}, {"text": "p", "fg": 2, "bold": true}, {"text": "a", "fg": 2, "bold": true}, {"text": "w", "fg": 2, "bold": true}, {"text": "n", "fg": 2, "bold": true}, {"fg": 2, "bold": true}, {"text": "s"}, {"text": "e"}, {"text": "s"}, {"text": "s"}, {"text": "i"}, {"text": "o"}, {"text": "n"}], [{"text": "$"}, {}, {"text": "t"}, {"text": "a"}, {"text": "i"}, {"text": "l"}, {}, {"text": "-"}, {"text": "f"}, {}, {"text": "a"}, {"text": "p"}, {"text": "p"}, {"text": "."}, {"text": "l"}, {"text": "o"}, {"text": "g"}], [{"text": "w", "fg": 3}, {"text": "a", "fg": 3}, {"text": "r", "fg": 3}, {"text": "n", "fg": 3}, {"text": ":", "fg": 3}, {}, {"text": "r"}, {"text": "e"}, {"text": "t"}, {"text": "r"}, {"text": "y"}], [], [], [], [], [], [], [], [], [], [], [], [], [], [], [], [], [], [], [], [], []], "case": "repaint-converge-b"}
