{"version": 1, "producer": {"name": "pyte", "version": "0.8.2"}, "size": {"cols": 80, "rows": 24}, "cursor": {"row": 2, "col": 79, "visible": true}, "altScreen": false, "title": "", "rows": [[{}, {}, {}, {}, {}, {}, {}, {}, {"text": "a"}, {}, {}, {}, {}, {}, {}, {}, {"text": "b"}, {}, {}, {}, {}, {}, {}, {}, {"text": "c"}], [{}, {}, {}, {}, {"text": "X"}, {}, {}, {}, {"text": "Y"}], [{}, {}, {}, {}, {}, {}, {}, {}, {}, {}, {}, {}, {}, {}, {}, {}, {}, {}, {}, {}, {}, {}, {}, {}, {}, {}, {}, {}, {}, {}, {}, {}, {}, {}, {}, {}, {}, {}, {}, {}, {}, {}, {}, {}, {}, {}, {}, {}, {}, {}, {}, {}, {}, {}, {}, {}, {}, {}, {}, {}, {}, {}, {}, {}, {}, {}, {}, {}, {}, {}, {}, {}, {}, {}, {}, {}, {}, {}, {}, {"text": "Z"}], [], [], [], [], [], [], [], [], [], [], [], [], [], [], [], [], [], [], [], [], []], "case": "tabs-hts-tbc"}
