{"version": 1, "producer": {"name": "pyte", "version": "0.8.2"}, "size": {"cols": 80, "rows": 24}, "cursor": {"row": 0, "col": 7, "visible": true}, "altScreen": false, "title": "", "rows": [[{"text": "n"}, {"text": "e"}, {"text": "w"}, {"text": "-"}, {"text": "t"}, {"text": "o"}, {"text": "p"}], [{"text": "f"}, {"text": "i"}, {"text": "r"}, {"text": "s"}, {"text": "t"}], [{"text": "s"}, {"text": "e"}, {"text": "c"}, {"text": "o"}, {"text": "n"}, {"text": "d"}], [], [], [], [], [], [], [], [], [], [], [], [], [], [], [], [], [], [], [], [], []], "case": "reverse-index-top"}
