{"version": 1, "producer": {"name": "pyte", "version": "0.8.2"}, "size": {"cols": 80, "rows": 24}, "cursor": {"row": 2, "col": 6, "visible": true, "style": null, "blink": null}, "altScreen": false, "title": "", "rows": [[{"text": "A"}, {"text": "漢", "width": 2}, {"text": "", "width": 0}, {"text": "B"}, {"text": "字", "width": 2}, {"text": "", "width": 0}, {"text": "C"}], [{"text": "テ", "width": 2}, {"text": "", "width": 0}, {"text": "ス", "width": 2}, {"text": "", "width": 0}, {"text": "ト", "width": 2}, {"text": "", "width": 0}], [{"text": "色", "width": 2, "fg": 5}, {"text": "", "width": 0, "fg": 5}, {"text": "付", "width": 2, "fg": 5}, {"text": "", "width": 0, "fg": 5}, {"text": "き", "width": 2, "fg": 5}, {"text": "", "width": 0, "fg": 5}], [], [], [], [], [], [], [], [], [], [], [], [], [], [], [], [], [], [], [], [], []], "case": "wide-cjk"}
