{"version": 1, "producer": {"name": "pyte", "version": "0.8.2"}, "size": {"cols": 80, "rows": 24}, "cursor": {"row": 2, "col": 0, "visible": true, "style": null, "blink": null}, "altScreen": false, "title": "", "rows": [[{"text": "A"}, {"text": "B"}, {}, {}, {}, {}, {"text": "G"}, {"text": "H"}, {"text": "I"}, {"text": "J"}], [{"text": "K"}, {"text": "L"}, {"text": "M"}], [], [], [], [], [], [], [], [], [], [], [], [], [], [], [], [], [], [], [], [], [], []], "case": "ech-erase"}
