{"version": 1, "producer": {"name": "pyte", "version": "0.8.2"}, "size": {"cols": 80, "rows": 24}, "cursor": {"row": 0, "col": 8, "visible": true, "style": null, "blink": null}, "altScreen": false, "title": "", "rows": [[{"text": "p"}, {"text": "r"}, {"text": "e"}, {}, {"text": "p"}, {"text": "o"}, {"text": "s"}, {"text": "t"}], [], [], [], [], [], [], [], [], [], [], [], [], [], [], [], [], [], [], [], [], [], [], []], "case": "osc1337-ignored"}
