{"version": 1, "producer": {"name": "pyte", "version": "0.8.2"}, "size": {"cols": 10, "rows": 4}, "cursor": {"row": 0, "col": 0, "visible": true, "style": null, "blink": null}, "altScreen": false, "title": "", "rows": [[{"text": "j"}, {"text": "u"}, {"text": "n"}, {"text": "k"}, {}, {"text": "j"}, {"text": "u"}, {"text": "n"}, {"text": "k"}], [{"bg": 2}, {"bg": 2}, {"bg": 2}, {"bg": 2}, {"bg": 2}, {"bg": 2}, {"bg": 2}, {"bg": 2}, {"bg": 2}, {"bg": 2}], [], []], "case": "bce-ed-bg"}
