{"version": 1, "producer": {"name": "pyte", "version": "0.8.2"}, "size": {"cols": 80, "rows": 24}, "cursor": {"row": 0, "col": 15, "visible": true, "style": null, "blink": null}, "altScreen": false, "title": "", "rows": [[{"text": "l"}, {"text": "i"}, {"text": "n"}, {"text": "k"}, {"text": "-"}, {"text": "t"}, {"text": "e"}, {"text": "x"}, {"text": "t"}, {}, {"text": "a"}, {"text": "f"}, {"text": "t"}, {"text": "e"}, {"text": "r"}], [], [], [], [], [], [], [], [], [], [], [], [], [], [], [], [], [], [], [], [], [], [], []], "case": "osc8-hyperlink"}
