{"version": 1, "producer": {"name": "pyte", "version": "0.8.2"}, "size": {"cols": 80, "rows": 24}, "cursor": {"row": 2, "col": 13, "visible": true}, "altScreen": true, "title": "", "rows": [[], [{}, {"text": "h"}, {"text": "i"}, {"text": "d"}, {"text": "d"}, {"text": "e"}, {"text": "n"}, {"text": "-"}, {"text": "m"}, {"text": "a"}, {"text": "i"}, {"text": "n"}], [{}, {}, {"text": "a"}, {"text": "l"}, {"text": "t"}, {"text": "-"}, {"text": "v"}, {"text": "i"}, {"text": "s"}, {"text": "i"}, {"text": "b"}, {"text": "l"}, {"text": "e"}], [], [], [], [], [], [], [], [], [], [], [], [], [], [], [], [], [], [], [], [], []], "case": "altscreen-active"}
