{"version": 1, "producer": {"name": "pyte", "version": "0.8.2"}, "size": {"cols": 80, "rows": 24}, "cursor": {"row": 7, "col": 32, "visible": true, "style": null, "blink": null}, "altScreen": false, "title": "", "rows": [[], [], [], [], [{}, {}, {}, {}, {}, {}, {}, {}, {}, {"text": "S"}], [{"text": "c"}, {"text": "p"}, {"text": "l"}], [{"text": "c"}, {"text": "n"}, {"text": "l"}], [{}, {}, {}, {"text": "v"}, {"text": "p"}, {"text": "a"}, {}, {}, {}, {}, {}, {}, {}, {}, {}, {}, {}, {}, {}, {}, {}, {}, {}, {}, {}, {}, {}, {}, {}, {"text": "c"}, {"text": "h"}, {"text": "a"}], [], [], [], [], [], [], [], [], [], [], [], [], [], [], [], []], "case": "cursor-line-col-ops"}
