{"version": 1, "producer": {"name": "pyte", "version": "0.8.2"}, "size": {"cols": 80, "rows": 24}, "cursor": {"row": 19, "col": 65, "visible": true}, "altScreen": false, "title": "", "rows": [[], [], [], [], [], [], [], [], [], [], [], [], [], [], [], [], [], [], [], [{}, {}, {}, {}, {}, {}, {}, {}, {}, {}, {}, {}, {}, {}, {}, {}, {}, {}, {}, {}, {}, {}, {}, {}, {}, {}, {}, {}, {}, {}, {}, {}, {}, {}, {}, {}, {}, {}, {}, {}, {}, {}, {}, {}, {}, {}, {}, {}, {}, {}, {}, {}, {}, {}, {}, {}, {}, {}, {}, {"text": "m"}, {"text": "o"}, {"text": "v"}, {"text": "e"}, {"text": "d"}, {"text": "X"}], [], [], [], []], "case": "cursor-save-restore-ansi"}
