{"version": 1, "producer": {"name": "pyte", "version": "0.8.2"}, "size": {"cols": 80, "rows": 24}, "cursor": {"row": 0, "col": 6, "visible": true}, "altScreen": false, "title": "final title", "rows": [[{"text": "t"}, {"text": "i"}, {"text": "t"}, {"text": "l"}, {"text": "e"}, {"text": "d"}], [], [], [], [], [], [], [], [], [], [], [], [], [], [], [], [], [], [], [], [], [], [], []], "case": "osc-title"}
