{"version": 1, "producer": {"name": "pyte", "version": "0.8.2"}, "size": {"cols": 80, "rows": 24}, "cursor": {"row": 7, "col": 5, "visible": true}, "altScreen": false, "title": "", "rows": [[{"text": "b", "bold": true}, {"text": "o", "bold": true}, {"text": "l", "bold": true}, {"text": "d", "bold": true}], [{"text": "d"}, {"text": "i"}, {"text": "m"}], [{"text": "i", "italic": true}, {"text": "t", "italic": true}, {"text": "a", "italic": true}, {"text": "l", "italic": true}, {"text": "i", "italic": true}, {"text": "c", "italic": true}], [{"text": "u", "underline": true}, {"text": "n", "underline": true}, {"text": "d", "underline": true}, {"text": "e", "underline": true}, {"text": "r", "underline": true}, {"text": "l", "underline": true}, {"text": "i", "underline": true}, {"text": "n", "underline": true}, {"text": "e", "underline": true}], [{"text": "b", "blink": true}, {"text": "l", "blink": true}, {"text": "i", "blink": true}, {"text": "n", "blink": true}, {"text": "k", "blink": true}], [{"text": "i", "inverse": true}, {"text": "n", "inverse": true}, {"text": "v", "inverse": true}, {"text": "e", "inverse": true}, {"text": "r", "inverse": true}, {"text": "s", "inverse": true}, {"text": "e", "inverse": true}], [{"text": "s", "strikethrough": true}, {"text": "t", "strikethrough": true}, {"text": "r", "strikethrough": true}, {"text": "i", "strikethrough": true}, {"text": "k", "strikethrough": true}, {"text": "e", "strikethrough": true}], [{"text": "o", "bold": true, "underline": true, "blink": true}, {"text": "n", "bold": true, "underline": true, "blink": true}, {"text": "o"}, {"text": "f"}, {"text": "f"}], [], [], [], [], [], [], [], [], [], [], [], [], [], [], [], []], "case": "sgr-attributes"}
