{"version": 1, "producer": {"name": "pyte", "version": "0.8.2"}, "size": {"cols": 80, "rows": 10}, "cursor": {"row": 0, "col": 0, "visible": true, "style": null, "blink": null}, "altScreen": false, "title": "", "rows": [[{"text": "l"}, {"text": "i"}, {"text": "n"}, {"text": "e"}, {"text": "-"}, {"text": "1"}], [{"text": "l"}, {"text": "i"}, {"text": "n"}, {"text": "e"}, {"text": "-"}, {"text": "2"}], [{"text": "l"}, {"text": "i"}, {"text": "n"}, {"text": "e"}, {"text": "-"}, {"text": "3"}], [{"text": "l"}, {"text": "i"}, {"text": "n"}, {"text": "e"}, {"text": "-"}, {"text": "4"}], [{"text": "l"}, {"text": "i"}, {"text": "n"}, {"text": "e"}, {"text": "-"}, {"text": "5"}], [{"text": "l"}, {"text": "i"}, {"text": "n"}, {"text": "e"}, {"text": "-"}, {"text": "6"}], [{"text": "l"}, {"text": "i"}, {"text": "n"}, {"text": "e"}, {"text": "-"}, {"text": "7"}], [{"text": "l"}, {"text": "i"}, {"text": "n"}, {"text": "e"}, {"text": "-"}, {"text": "8"}], [{"text": "l"}, {"text": "i"}, {"text": "n"}, {"text": "e"}, {"text": "-"}, {"text": "9"}], [{"text": "l"}, {"text": "i"}, {"text": "n"}, {"text": "e"}, {"text": "-"}, {"text": "1"}, {"text": "0"}]], "case": "su-sd-scroll"}
