{"version": 1, "producer": {"name": "pyte", "version": "0.8.2"}, "size": {"cols": 80, "rows": 24}, "cursor": {"row": 0, "col": 25, "visible": true}, "altScreen": false, "title": "", "rows": [[{"text": "a", "fg": 1, "bg": 3, "bold": true, "underline": true}, {"text": "l", "fg": 1, "bg": 3, "bold": true, "underline": true}, {"text": "l", "fg": 1, "bg": 3, "bold": true, "underline": true}, {"text": "n", "fg": 1, "bg": 3, "bold": true}, {"text": "o", "fg": 1, "bg": 3, "bold": true}, {"text": "-", "fg": 1, "bg": 3, "bold": true}, {"text": "u", "fg": 1, "bg": 3, "bold": true}, {"text": "l", "fg": 1, "bg": 3, "bold": true}, {"text": "d", "bg": 3, "bold": true}, {"text": "e", "bg": 3, "bold": true}, {"text": "f", "bg": 3, "bold": true}, {"text": "-", "bg": 3, "bold": true}, {"text": "f", "bg": 3, "bold": true}, {"text": "g", "bg": 3, "bold": true}, {"text": "d", "bold": true}, {"text": "e", "bold": true}, {"text": "f", "bold": true}, {"text": "-", "bold": true}, {"text": "b", "bold": true}, {"text": "g", "bold": true}, {"text": "p"}, {"text": "l"}, {"text": "a"}, {"text": "i"}, {"text": "n"}], [], [], [], [], [], [], [], [], [], [], [], [], [], [], [], [], [], [], [], [], [], [], []], "case": "sgr-combos"}
