{"version": 1, "producer": {"name": "pyte", "version": "0.8.2"}, "size": {"cols": 80, "rows": 12}, "cursor": {"row": 11, "col": 0, "visible": true, "style": null, "blink": null}, "altScreen": false, "title": "", "rows": [[], [], [], [], [{"text": "b"}, {"text": "o"}, {"text": "t"}, {"text": "t"}, {"text": "o"}, {"text": "m"}, {"text": "-"}, {"text": "c"}, {"text": "l"}, {"text": "a"}, {"text": "m"}, {"text": "p"}, {"text": "e"}, {"text": "d"}], [{}, {}, {}, {}, {}, {}, {}, {}, {}, {}, {}, {}, {}, {}, {}, {}, {}, {}, {}, {}, {}, {}, {}, {}, {}, {}, {}, {}, {}, {}, {}, {}, {}, {}, {}, {}, {}, {}, {}, {}, {}, {}, {}, {}, {}, {}, {}, {}, {}, {}, {}, {}, {}, {}, {}, {}, {}, {}, {}, {}, {}, {}, {}, {}, {}, {}, {}, {}, {}, {"text": "r"}, {"text": "o"}, {"text": "w"}, {"text": "2"}, {"text": "-"}, {"text": "i"}, {"text": "n"}, {"text": "-"}, {"text": "r"}, {"text": "e"}, {"text": "g"}], [{"text": "i"}, {"text": "o"}, {"text": "n"}], [], [], [], [], []], "case": "decom-outside-region"}
