{"version": 1, "producer": {"name": "pyte", "version": "0.8.2"}, "size": {"cols": 80, "rows": 24}, "cursor": {"row": 2, "col": 0, "visible": true, "style": null, "blink": null}, "altScreen": false, "title": "", "rows": [[{"text": "😀", "width": 2}, {"text": "", "width": 0}, {"text": "X"}], [{"text": "A"}, {"text": "🚀", "width": 2}, {"text": "", "width": 0}, {"text": "B"}], [], [], [], [], [], [], [], [], [], [], [], [], [], [], [], [], [], [], [], [], [], []], "case": "emoji-width"}
